{
  "$schema": "https://json-schema.org/draft/2020-12/schema",
  "type": "object",
  "properties": {
    "jobId": {
      "type": "string"
    },
    "taskId": {
      "type": "string"
    },
    "taskTitle": {
      "type": "string"
    },
    "createdBy": {
      "type": "object",
      "properties": {
        "id": {
          "type": "string"
        },
        "name": {
          "type": "string"
        }
      },
      "required": [
        "id",
        "name"
      ],
      "additionalProperties": false
    },
    "createdAt": {
      "type": "string"
    },
    "startedAt": {
      "type": "string"
    },
    "finishedAt": {
      "type": "string"
    },
    "state": {
      "type": "string",
      "enum": [
        "pending",
        "running",
        "success",
        "error",
        "cancelled"
      ]
    },
    "resultState": {
      "type": "string",
      "enum": [
        "waiting",
        "ready",
        "incomplete",
        "unavailable"
      ]
    },
    "progress": {
      "type": "number",
      "minimum": 0,
      "maximum": 1
    },
    "outputSummary": {
      "type": "object",
      "properties": {
        "recorded": {
          "type": "integer",
          "minimum": 0,
          "maximum": 9007199254740991
        },
        "missing": {
          "type": "integer",
          "minimum": 0,
          "maximum": 9007199254740991
        }
      },
      "required": [
        "recorded",
        "missing"
      ],
      "additionalProperties": false
    }
  },
  "required": [
    "jobId",
    "taskId",
    "taskTitle",
    "createdBy",
    "createdAt",
    "state",
    "resultState"
  ],
  "additionalProperties": false
}
